Title,Author,Fandom,Url,Kudos,Summary
Yang Jungwon's HeeJake Manual,sunoomoons,ENHYPEN (Band),https://archiveofourown.org/works/34324429,"2,577","Summary: Jungwon has never seen his brother Heeseung smile as brightly as he does after meeting his Math tutor, Sim Jake. So Jungwon, being the best brother he is, takes it upon himself to commence Mission HeeJake with the help of Heeseung's friends. What could possibly go wrong?  (or, Heeseung and Jake's chaotic ""love life"" through the eyes of 6 year old Jungwon)"
i love you––ain't that the worst thing you ever heard?,hyacinthmoon,ENHYPEN (Band),https://archiveofourown.org/works/32734582,"2,577","Summary: For his entire high school career, Park Sunghoon has been a constant thorn in Sunoo's side. Apparently, he has made it his life goal to make Sunoo's whole experience as miserable as possible. Sunoo swears he joined student council just to bug him. So, you can imagine his horror when he's told that he and Sunghoon will be sharing a room on their annual class trip, non negotiable. He's not sure if either of them will be coming out of this trip alive."
"flights, fights, and long nights",ramentoast,ENHYPEN (Band),https://archiveofourown.org/works/43333746,"2,548","Summary: Sunghoon doesn't know when his feelings started to change. First, he was staring longer. Harder. At the curve of Sunoo's face, the softness of his legs, and the slope of his eyes. Then, he had the urge to touch him. Poke him, hug him, randomly ruffle his hair--you name it. Now, he wants to be with him. Romantically. But there's one problem... Sunoo doesn't seem to want anything to do with him. Or, Sunghoon realizes he's too harsh on Sunoo, and does everything he can to fix it."
spring day,Bangtanbananas,EXO (Band),https://archiveofourown.org/works/9882227,"11,851","Summary: Even when he was a pup, Park Jimin never even dreamed that he would find his soulmate. Thoughts like that were better left to his hopelessly romantic best friend and partner in crime, Kim Taehyung. It's a one in a million chance, but a twist of fate brings a strange wolf into Jimin's life and it changes things forever."
Hidden Omega,PrussiaSheiala,EXO (Band),https://archiveofourown.org/works/8610472,"9,662","Summary: At 21 Namjoon still hasn't presented with a subgender, leaving him as a dud. With the BTS pack having their own issues and not treating him like a real member Namjoon is left alone and a tragic event forces Namjoon's body to present as an omega. Realising exactly what they have done, the BTS strive for change and to make up for the real hurt they have coursed Namjoon, but is it too late? Or will one of the 4 other packs courting the newly presented omega end up winning his heart, Or maybe a darkhorse will appear //FINISHED: January 1st, 2021"
On the Booze With Brahms,baeconandeggs,EXO (Band),https://archiveofourown.org/works/3936838,"6,929",Summary: Chanyeol has never heard someone say puppy like the asshole violinist next door does.
King's Lost Prince,Hyperionova,EXO (Band),https://archiveofourown.org/works/7592749,"6,883","Summary: A vengeful assassin Prince and a sadistic, cold-blooded King. The half-brothers' shattering adventure."
Eclipse,Bangtanbananas,EXO (Band),https://archiveofourown.org/works/13170726,"6,768","Summary: After the tragic death of his parents, Jeon Jeongguk hated werewolves. The last thing he ever expected was to fall in love with one."
Soulbinder,Hyperionova,EXO (Band),https://archiveofourown.org/works/16510940,"4,941","Summary: When Sehun binds his soul to an Alpha in a Regnandi pack, he is only fifteen. Over the years, one tragedy after another leaves him forlorn and abandoned, his soul still longing for its binder. As an androgynous Omega in an Aequus pack, Sehun has no chance of becoming an Alpha's mate. And his soulbinder is not going to risk expatriation from his pack and family by accepting an Aequus for a mate."
Nepenthe,BBQkitten,EXO (Band),https://archiveofourown.org/works/27532750,"4,804","Summary: Jungkook woke to full body aches. He groaned, burying his face into the mattress as his muscles spasmed. Fuck. He bit his lip and his muscles tensed and untensed again. He needed to call in to work. He couldn’t afford to be sick but he didn’t have a choice. He knew he couldn’t work in heat. Normal heats were bad enough but his were an absolute nightmare since— Jungkook closed his eyes, clutching at his abdomen where a thick scar ran across horizontally. No. Don't think about it. OR Jungkook is an omega just trying to survive until he meets a pack that teaches him how to live."
97-Liners Groupchat,Novii,EXO (Band),https://archiveofourown.org/works/18841864,"4,271","Summary: Thaibaby: EUNWOO Thaibaby: DO ALIENS EXIST OR NOT EarlyBird: HOW AM I SUPPOSED TO KNOW Thaibaby: YOUR GROUPS NAME IS ASTRO Megaphone: you lost me there Greekgod: yeah me too Lostboy: jae you made everyone lost EarlyBird: I- EarlyBird: so that makes me the expert on all things space??? HitTheYug: YES Thaibaby: YES KookieMonster: got7 really do share one braincell EiffelPuppy: no kidding ________ Or somehow this went from a meaningless crack fic to a meaningless crack, slight angst and fluff fic. Oh and they troll dispatch."
A Prize to be Claimed,byunthebunny,EXO (Band),https://archiveofourown.org/works/17394146,"4,144","Summary: Baekhyun didn’t think much of it when Chanyeol, his childhood nemesis, won a tournament held by their pack. That is, until said nemesis demanded him as a prize."
If The Police Ask,baeconandeggs,EXO (Band),https://archiveofourown.org/works/3937288,"3,890","Summary: Falling in love through the lens of your telescope seemed impossible, stupid even. Especially when you are thirteen. But, if as time goes by your feelings for your seven years older next door neighbor only grow stronger, would it still be considered a childish crush?"
Staring Through the Demons,Bexless,Fall Out Boy,https://archiveofourown.org/works/231222,"3,482","Summary: Pete and Patrick were still looking expectant, so Mikey said, “So we’re a group of…traveling…personal grooming experts. I guess.” Patrick looked at Gerard. “And their priest.” “We’re very spiritual,” Ray mumbled."
the joker laughs at you (don't you think?),SoloChaos,Fall Out Boy,https://archiveofourown.org/works/1198281,"3,015","Summary: Joshua Dun has a nice mouth. Tyler isn't gay, you guys."
A Little Infamy,ladyfoxxx,Fall Out Boy,https://archiveofourown.org/works/858826,"2,884",Summary: Patrick is a solo artist who's sunk his heart and soul into a second album that's failing to chart. Obviously what he needs to bump up sales and dirty up his nice guy image is a sex scandal. His music label hire amateur porn star and aspiring poet Pete to pose as Patrick's boyfriend and together they make one intimate video destined for infamy on the internet. Patrick falling for Pete isn't part of the plan.
500 Baskets,emeraldcitydowntowngirl,Fall Out Boy,https://archiveofourown.org/works/5836147,"2,736","Summary: The rule was simple: Make 500 baskets, or you don’t get dinner. - Contrary to popular belief, basketball player Tyler Joseph doesn’t have it as good as everyone* thinks he does *Josh Dun, the quote unquote new kid with blue hair and crazy friends"
These Eyes Are Blind,Helena_Hathaway,Fall Out Boy,https://archiveofourown.org/works/2416469,"2,727","Summary: They say love is blind, but Frank's taking that to a more literal sense. So many people try to distance themselves from being called normal, but that's really all Frank wants. He's sick of being different. He's also sick of being alone, but he's made himself comfortable with it. To be blind is to be alone. Or at least he'd had every intention to be alone until he met Gerard. All Frank wants is to be normal, but it's Gerard who wants to make him see that he's far from it. Frank can't see with his eyes, but with his heart he sees Gerard, and he sees the beauty there."
The Group Chat AU That Nobody Asked For,Reddxn,Fall Out Boy,https://archiveofourown.org/works/8232398,"2,628",Summary: Frank makes a group chat and things (repeatedly) get out of hand
Inch of Skin,the_ragnarok,Fall Out Boy,https://archiveofourown.org/works/3225056,"2,484","Summary: In his interviews, Pete Wentz likes to joke about the soulmark. He went on a talk show once with his right wrist bared to show a temporary Care Bear tattoo. There was kind of a media uproar about it, which is the only reason Patrick knows this—he doesn't even follow media for musicians he likes. He's not going to do it for a pop-punk teen heartthrob who sold his soul to MTV."
The Chasing of Moons,Helena_Hathaway,Fall Out Boy,https://archiveofourown.org/works/3671964,"2,361","Summary: The biggest dilemma in all of this is that Frank slept with his future husband. Now Frank’s just got to make sure that the future with him stays intact, but it’s not so easy when present day Gerard seems to hate his guts."
Filthy Lucre.,risky_business,Fall Out Boy,https://archiveofourown.org/works/1039530,"2,220","Summary: AU. Ryan Ross is living the American wet dream. He’s rich, he’s good looking, he’s paid just to turn up at parties and he spends his days doing drugs and climbing into bed with eager and willing boys and girls. Brendon Urie is a man bordering on desperation – whoring himself out to wealthy men in an attempt to support himself and his best friend’s worsening drug habit. When his job ensnares him in the glamorous world of the rich and the infamous, it’s not long before their paths cross and Ryan starts living his dark fantasies though Brendon – but only for a price. See tags for triggers."
Hidden Omega,PrussiaSheiala,GOT7,https://archiveofourown.org/works/8610472,"9,662","Summary: At 21 Namjoon still hasn't presented with a subgender, leaving him as a dud. With the BTS pack having their own issues and not treating him like a real member Namjoon is left alone and a tragic event forces Namjoon's body to present as an omega. Realising exactly what they have done, the BTS strive for change and to make up for the real hurt they have coursed Namjoon, but is it too late? Or will one of the 4 other packs courting the newly presented omega end up winning his heart, Or maybe a darkhorse will appear //FINISHED: January 1st, 2021"
The Companion,Arobeebee,GOT7,https://archiveofourown.org/works/14764478,"9,118","Summary: Wealthy CEO Kim Namjoon adopts a very special bunny hybrid as an anniversary present for his five boyfriends. This is the story of Jungkook's new life as an adopted companion, his trials and tribulations as he learns how to live as part of human society, and the friends he makes along the way.  (Basically just an excuse for gratuitous bunny!Jungkook sexytimes. Open for requests.)"
He Ain't Heavy (he's our maknae),LulaWrites,GOT7,https://archiveofourown.org/works/10510071,"7,523","Summary: A series of short, stand-alone stories detailing the lives of bad-at-selfcare Jungkook and his overprotective hyungs. (See inside for full story index.) Chapter 15: Stay Woke ---- Jungkook hasn't slept properly in four days, and he's about to reach breaking point. Chapter 16: Sweet Like Chocolate ---- Sometimes misery is self-inflicted (but oh, so tasty). Chapter 17: Sleep Tight ---- A recurring nightmare is plaguing Jungkook’s dreams and he doesn't know how to make it stop. Chapter 18: A Step Too Far ---- Jungkook falls down the stairs, and decides to avoid embarrassment by keeping news of the accident to himself. Chapter 19: As The Proverbial Kite ---- After a trip to hospital, Jungkook's left feeling pretty high. Chapter 20: A Late Night Stroll (Part 1) ---- Jungkook’s nocturnal activities have the rest of BTS feeling a little on edge.  (NEW!) Chapter 21: Sunny-Side Up ---- After falling asleep by the pool during their Hawaii vacation, Jungkook learns the hard way that even factor-50 sunscreen has its limits."
Playhouse,seitsemannen,GOT7,https://archiveofourown.org/works/5244977,"5,169","Summary: All sorts of rumours surround the handsome Wang heir and the good-looking servants of his household, but no one seemed to know for sure, as no matter the price, the members were not willing to give the secrets of their Master up. Mark doesn't care for celebrities or rumours, except the one that says the Wang household pays several times more than the usual servant's salary, so when there's a job opening at the House, he goes for it. In the days and weeks spent at the House, Mark gets to know the members and finds out what of the ludicrous rumours were true and what weren’t. What he did not know to expect, however, is how good friends he would become with the other members of the House, and what’s worse, that he would fall in love with Jackson Wang."
97-Liners Groupchat,Novii,GOT7,https://archiveofourown.org/works/18841864,"4,271","Summary: Thaibaby: EUNWOO Thaibaby: DO ALIENS EXIST OR NOT EarlyBird: HOW AM I SUPPOSED TO KNOW Thaibaby: YOUR GROUPS NAME IS ASTRO Megaphone: you lost me there Greekgod: yeah me too Lostboy: jae you made everyone lost EarlyBird: I- EarlyBird: so that makes me the expert on all things space??? HitTheYug: YES Thaibaby: YES KookieMonster: got7 really do share one braincell EiffelPuppy: no kidding ________ Or somehow this went from a meaningless crack fic to a meaningless crack, slight angst and fluff fic. Oh and they troll dispatch."
Selfless,MuscleBunni,GOT7,https://archiveofourown.org/works/15894045,"4,197","Summary: Jungkook always cares too much for people he's never met, but when 6 boys come into his life he really doesn't have a choice but to help them. Falling in love however, wasn't really apart of his plan..."
The Tiger & The Duke,foxxing,GOT7,https://archiveofourown.org/works/10826343,"4,100","Summary: Im Jaebum is the richest man in the country under forty, content to mess around and skirt the headlines as a cutthroat businessman and casual playboy. Park Jinyoung is a graduated English Literature major, content with (in Jackson's words) his boring life working at a restaurant and writing poetry. When their worlds collide over a spilled cup of coffee, Jinyoung learns there's a lot more to life than the secrets of his past and the safety of library books."
Redamancy,BBQkitten,GOT7,https://archiveofourown.org/works/26536939,"3,995","Summary: It goes like this: Jungkook is back at the cafe, a different patron but the view still the same. Forced to watch as the sun shard pierces Yoongi’s chest, the light quickly refracting in the vampire’s body and turning him to ash in seconds. He hears the vampire-hyung scream in pain and terror and can do nothing but watch in morbid fascination as his dongsaeng dies right before his eyes. He doesn’t want to see this again. Yoongi can’t die. He runs. OR Jeon Jungkook can see the future (kinda) and ends up saving a vampire bureaucrat which leads him to a happily ever after he never imagined he could have with six very loving, overprotective hyungs."
Bring Them Home,Survivor4Life,GOT7,https://archiveofourown.org/works/18330614,"3,587","Summary: ""Hyung … I tried to stop them …"" ""Stop who? What's happening?"" ""They took them."""
Always By My Side,bb_bambam,GOT7,https://archiveofourown.org/works/6403483,"3,545","Summary: Soulmates!AU where after you meet your soulmate, you experience physical pain when you’re apart for more than 12 hours until you both acknowledge that you’re soulmates. Essentially, it takes Jinyoung and Jaebeom way longer than it should have to figure out that they’re soulmates."
soft serve ice cream,sunshinesakae,Jpop,https://archiveofourown.org/works/16137326,834,Summary: Yuzuki and Kuma go on cute dates.
orbital,massuki (yehaesuki),Jpop,https://archiveofourown.org/works/36556645,558,"Summary: Two stars on separate orbits circling around a common dream are suddenly set on a collision course when the powers-that-be decide that they'd be the perfect fit for a high school BL drama. a.k.a. that one time Producer Ohkura took a gamble and Producer Takizawa said ""yes, but I'm getting half the profit."" Not real, didn't happen, only inspired by real events and I'm taking some creative liberties just for fun. Enjoy? :)"
Silvered Gold of Dying Days,64907,Jpop,https://archiveofourown.org/works/10796373,531,"Summary: He was recommended to Jun, and Jun knows that it also meant that Aiba recommended Jun to him. These kinds of things go both ways."
can't say I love you,mikunicchi,Jpop,https://archiveofourown.org/works/20169310,492,"Summary: Nino knew that his life was going to change when he agreed to the marriage. However, marrying the nationwide famous actor Matsumoto Jun was something he hadn't been expecting at all."
Kaede,ChocolateOrange,Jpop,https://archiveofourown.org/works/4992685,491,Summary: A daughter unwanted.
a heart can speak volumes,orphan_account,Jpop,https://archiveofourown.org/works/15880650,399,"Summary: '“The best way to learn a language is from immersion,” Chaeyeon once told her in Japanese, very brokenly and heavily-accented and while holding a Korean to Japanese dictionary. “Speak Korean to me, Kura-chan.”'"
MLM/NBLM Smut One-shots For the Touch-Starved Gays,w3r3w0lfk1n,Jpop,https://archiveofourown.org/works/28121004,398,Summary: im gay youre gay we're all gay and most of us are also horny. i am here 2 provide
Unnatural,Wilderfox,Jpop,https://archiveofourown.org/works/27007969,387,"Summary: After being expelled from her school in Sendai, Moriya Akane continue to pursue her education at Sakurazaka Academy, which is synonymous with an elite private school with students who don't like to get into trouble. Hoping for a better life as a normal teenager, who would have thought that she would get involved with a big problem that would become a turning point in her life? What is the dark secret that has been hidden behind the white uniform of Sakurazaka Academy?"
Lost & Found,reveetoile,Jpop,https://archiveofourown.org/works/14556801,302,"Summary: Okay: I decided to change the warning because I got begged by friends. There might be a one-shot about the character death that I've planned but it won't be in this story. So Ohno survives. If that held you back, feel free to read this story. But be warned Ohno is still ill for the most part of this story.  Ohno meets Nino in hospital after Nino was in an accident with his parents. He didn't know how many lives would change now."
Between the Shadow and the Soul,64907,Jpop,https://archiveofourown.org/works/30015924,278,"Summary: After the earthquake, Sho moves back to his hometown hoping for a better future than the one he just lost. He finds work in a strange orphanage that has no children, but the mystery doesn’t end there."
The Songbird and the Sea,maia_archives,K-pop,https://archiveofourown.org/works/10795731,"43,897","Summary: In a world where dominance of the sea is an endless battle between pirates and mariners, Park Jimin is content living in his little village on a small, uninteresting island by the eastern mainland. He wants nothing to do with the bloodshed of good and evil, the heartless killing of both innocents and condemned, the constant establishment and disruption of order. What he wants is peace, to live his life in the same town he was born in, to spend his days in the beautiful forest, and to use the powers of his Blessed Rune to nurture the home he loves so dearly. But when his island is attacked by pirates, Jimin will have no other choice than to do as they command and leave all thoughts of peace behind in favor of boarding the Agust, a pirate ship captained by the infamous Min Yoongi, Black Fox of the East.    Note: information about sequels available in epilogue author's notes."
House of Cards,sugamins (orphan_account),K-pop,https://archiveofourown.org/works/5293532,"36,860","Summary: Jungkook is the heir to a mob empire, the most notorious in the whole of Seoul. Taehyung is a rookie sent in to infiltrate by his select team and bring the empire crumbling down. ""You knew the game and played it, it kills to know that you have been defeated."""
Fall Asleep (Fall For You),drannie,K-pop,https://archiveofourown.org/works/11193654,"34,926","Summary: “They say when you fall in love you can’t fall asleep, but now that I’ve met you I feel like I finally can.”  A University AU where Jungkook and Taehyung become roommates. But Jungkook has insomnia and can't fall asleep with other people and Taehyung can't fall asleep alone."
"refrigerator humming, chewing gum and instant karma",locks,K-pop,https://archiveofourown.org/works/9500051,"31,542","Summary: Taehyung sets the flowers down on the dining table, plucking the card off the little holder. ""Dearest Taehyung, just wanted you to know that I'm thinking about you. I hope you're thinking about me too. Love--"" he pauses and squints before cocking an eyebrow and pursing his lips. ""Hyung, why is the boss of your little boy band gang professing his love for me?"" Yoongi drops the noodles on the floor with a loud curse as he burns his hand. Or, Taehyung's been trying his hardest to avoid Yoongi's criminal life for a long ass time, but a cute kid and his infuriating father keep pulling him deeper into the mix."
A Gilded World,smiles,K-pop,https://archiveofourown.org/works/8416441,"29,582","Summary: Jeon Seokjin has exactly four weeks to stop the impending engagement of his younger brother, doomed to a loveless marriage. The only way to stop it is to make a better match, more advantageous, more lucrative for the Jeon family. It's impossible. It's his only option. Min Yoongi does not want, will never want, will never ever even consider, marriage. It's not in the cards. He's stubborn enough to achieve the total ban on marriage talks. Except maybe his grandmother is a little more stubborn than he is, and maybe she's determined to see him march down the aisle. The chaebol arranged marriage au that exactly one and a half people asked for."
i forget to breathe (when i'm with you),locks,K-pop,https://archiveofourown.org/works/10282934,"27,885","Summary: ""Do we have a deal, angel,"" Taehyung repeats, and Jeongguk can hear that he's losing his patience, hands resting on his hips. Jeongguk lifts his head, snapping the lid closed. ""Pleasure doing business with you, daddy,"" he nods, sending a grin up to Taehyung who just narrows his eyes at him. ""You're lucky I like you,"" Taehyung mutters, sounding mildly threatening as he steps over to him and tilts Jeongguk's chin up, leaning down to press a kiss against his lips. Lucky doesn't even come close. Or, Jeongguk's trying to figure out how he ended up with a sugar daddy when all he wanted was a couple packets of instant noodles."
It Might Just Come Back To Bite You,Arobeebee,K-pop,https://archiveofourown.org/works/17857460,"24,629","Summary: After Jungkook goes out of his way to help a sickly-looking stranger on a rainy night, the universe chooses to reward him in the most bizarre and unexpected way possible – with a nest of overprotective Vampire sugar-daddies."
Fake Sugar,minverse,K-pop,https://archiveofourown.org/works/14707098,"24,106","Summary: ""I guess,"" Jungkook pauses momentarily to inhale a deep, bracing breath, ""I would just want you to come to my work events and laugh at my jokes and don't correct people if they imply that we're doing it."" ""Having sex, you mean,"" Jin clarifies gently, and Jungkook chokes on air. If his face was any redder, Jin would insist on taking him to the hospital. Jungkook clears his throat, obviously trying to play off the strangled, choked sound as a casual cough. ""Yes. Doing... sex."" (Hedge Fund wunderkind and Certified Awkward Gay Jungkook needs a sugar baby to show off at work, and Professional Competitive Eater and Objectively Beautiful Human Jin just wants to stop working shitty side-jobs. Fake Sugar Daddy AU. A trope and a half.)"
Mutual Help,personasintro,K-pop,https://archiveofourown.org/works/30222195,"23,976","Summary: In order for you to pretend to be his girlfriend, he helps you with your sexual desires - he calls it a mutual help"
cuz in a sky full of stars (i think i saw you),wowoashley (orphan_account),K-pop,https://archiveofourown.org/works/3476741,"23,890",Summary: taehyung always has bad ideas. and jeongguk thinks this might be the best.
Hidden Omega,PrussiaSheiala,Monsta X (Band),https://archiveofourown.org/works/8610472,"9,662","Summary: At 21 Namjoon still hasn't presented with a subgender, leaving him as a dud. With the BTS pack having their own issues and not treating him like a real member Namjoon is left alone and a tragic event forces Namjoon's body to present as an omega. Realising exactly what they have done, the BTS strive for change and to make up for the real hurt they have coursed Namjoon, but is it too late? Or will one of the 4 other packs courting the newly presented omega end up winning his heart, Or maybe a darkhorse will appear //FINISHED: January 1st, 2021"
Wrong (Right) Number,Alette,Monsta X (Band),https://archiveofourown.org/works/10912671,"6,681",Summary: +82-1-145-0xxx: I Fck FUCK Oh my god Omg im so sorry Omg i mustve put in the wrong number ♡｡･:*:･ﾟ★ Yeonjae ･:*:･ﾟ★｡♡ : Really? Who would’ve thought? Chae Hyungwon receives a text from a stranger swearing at him. It turns out less annoying than he'd ever imagined
