Title,Author,Fandom,Url,Kudos,Summary,Content
Love Shot,KimJumin,"iKON (Korea Band), SEVENTEEN (Band), INFINITE (Band), TWICE (Band), NU'EST, WAYV, NCT (Band), AB6IX (Band), Stray Kids (Band), Monsta X (Band), EXO (Band), Winner (Band), TXT (Korea Band), Weki Meki (Band), WayV (Band ), GOT7, VIXX, Golden Child (Korea Band), SHINee, The Boyz (Korea Band)",https://archiveofourown.org/works/18487243,"1,113",Summary: K-pop Male X Male One shots!~ Also includes Female X Female..,Explicit Creator Chose Not To Use Archive Warnings No Archive Warnings Apply Rape/Non-Con Underage M/M F/F Multi iKON (Korea Band) SEVENTEEN (Band) INFINITE (Band) TWICE (Band) NU'EST WAYV NCT (Band) AB6IX (Band) Stray Kids (Band) Monsta X (Band) EXO (Band) Winner (Band) TXT (Korea Band) Weki Meki (Band) WayV (Band ) GOT7 VIXX Golden Child (Korea Band) SHINee The Boyz (Korea Band) Choi Seungcheol | S.Coups/Yoon Jeonghan Kim Hanbin | B.I/Kim Jiwon | Bobby Kim Sunggyu/Nam Woohyun Choi Seungcheol | S.Coups/Kim Mingyu Hirai Momo/Minatozaki Sana Hwang Minhyun/Kim Jonghyun | JR Choi Seungcheol | S.Coups/Lee Jihoon | Woozi Dong Si Cheng | WinWin/Chittaphon Leechaiyapornkul | Ten Lim Youngmin/Park Woojin Choi Seungcheol | S.Coups/Jeon Wonwoo Kim Donghyuk/Kim Hanbin | B.I Chittaphon Leechaiyapornkul | Ten/Liu Yang Yang | YangYang Lee Taeyong/Chittaphon Leechaiyapornkul | Ten Bang Chan/Seo Changbin Choi Seungcheol | S.Coups/Shin Hoseok | Wonho Byun Baekhyun/Zhang Yi Xing | Lay Kang Seungyoon/Song Minho | Mino Choi Seungcheol | S.Coups/Kwon Soonyoung | Hoshi Huang Ren Jun/Lee Jeno/Na Jaemin Kim Mingyu/Lee Seokmin | DK/Xu Ming Hao | The8 Kim Mingyu/Xu Ming Hao | The8 Lee Seokmin | DK/Xu Ming Hao | The8 Male reader/Lee Taeyong Lee Taeyong/Male Reader Choi Yeonjun/Park Jimin (BTS) Im Changkyun | I.M/Lee Jooheon Noh Hyojung | Lucy/Kim Doyeon Han Jisung | Han/Seo Changbin Huang Ren Jun/Chittaphon Leechaiyapornkul | Ten Huang Ren Jun/Park Jisung Bang Chan/Han Jisung | Han Kim Jongin | Kai/Oh Sehun Byun Baekhyun/Kim Jongdae | Chen Choi Yeonjun/Huening Kai Kim Yugyeom/Park Jinyoung Han Jisung | Han/Park Jisung (NCT) Im Jaebum | JB/Park Jinyoung Kim Doyoung/Huang Ren Jun Huang Ren Jun/Kim Dongyoung | Doyoung Kim Wonshik | Ravi/Kim Seonho Choi Sungyoon | Y/Kim Donghyun Lee Taemin/Wong Yuk Hei | Lucas Kim Sunwoo/Lee Juyeon (The Boyz) Possessive Behavior bottom!seungcheol Top!Jeonghan Bottom!Bobby Top!hanbin Jealous!bobby top!mingyu Bratty seungcheol Soft dom!mingyu jealous mingyu Jealous Hanbin Dom Lee Jihoon | Woozi top!woozi top!Jihoon Top!winwin Bottom! Ten Top Dong Si Cheng | WinWin Bottom Chittaphon Leechaiyapornkul | Ten Tenwin Top!Woojin Bottom!Youngmin Implied top! Wonwoo Top!donghyuk Bottom Kim Hanbin | B.I Top Kim Donghyuk Top!Yangyang Top! Changbin Bottom Chan Bottom Bang Chan Top Shin Hoseok | Wonho Top Zhang Yi Xing | Lay Bottom Byun Baekhyun Bottom Seungyoon bottom Kang Seungyoon Top Song Mino Bottom Lim Youngmin Top Na Jaemin Top Lee Jeno Smut Threesome - M/M/M Top Kim Mingyu Top Lee Seokmin | DK Bottom Xu Ming Hao | The8 Minghao-centric Double Penetration Jealous Lee Taeyong Male reader x Taeyong Bottom Lee Taeyong Dominant Lee Taeyong Top Male Reader - Freeform Submissive Male reader Power Bottom Lee Taeyong Sugar Daddy Park Jimin Yeonmin Bottom Im Changkyun | I.M Shy Kim Doyeon Top Seo Changbin Bottom Han Jisung | Han Rape/Non-con Elements rensung banghan Incest Jonghun - Freeform Implied Top Oh Sehun Implied top Heuning Kai Kaijun Established Huening Kai/Choi Yeonjun Vampire Han Jisung | Han Top Kim Dongyoung | Doyoung Bottom Huang Ren Jun Bottom Choi Sungyoon | Y Top Wong Yuk Hei | Lucas Bottom Lee Taemin Bottom Lee Juyeon Top Kim Sunwoo
orbital,massuki (yehaesuki),"Snow Man (Japan Band), なにわ男子 | Naniwa Danshi (Band), Johnny's Entertainment, 消えた初恋 | Kieta Hatsukoi | Vanishing My First Love (TV) RPF",https://archiveofourown.org/works/36556645,558,"Summary: Two stars on separate orbits circling around a common dream are suddenly set on a collision course when the powers-that-be decide that they'd be the perfect fit for a high school BL drama. a.k.a. that one time Producer Ohkura took a gamble and Producer Takizawa said ""yes, but I'm getting half the profit."" Not real, didn't happen, only inspired by real events and I'm taking some creative liberties just for fun. Enjoy? :)",Teen And Up Audiences No Archive Warnings Apply M/M Snow Man (Japan Band) なにわ男子 | Naniwa Danshi (Band) Johnny's Entertainment 消えた初恋 | Kieta Hatsukoi | Vanishing My First Love (TV) RPF Meguro Ren/Michieda Shunsuke Meguro Ren Michieda Shunsuke definitely didn't happen nope idol au trope but it's not an au? should have added slowburn from the start but i thought that went without saying
these overflowing dreams (don't pass them by),dreamweavernyx,Snow Man (Japan Band),https://archiveofourown.org/works/32046298,135,"Summary: ""In this world there are adventurers and heroes, dragons and demons, monsters and magic. And perhaps, the magic of brotherhood, of people of like mind coming together and fighting with a purpose, can become the strongest force of all.""  Vignettes of 9 young adventurers, setting out on a journey to forge their own story, and the friendships they create on the way. Snow Man RPG-inspired fantasy! AU.",General Audiences No Archive Warnings Apply M/M Snow Man (Japan Band) Abe Ryouhei/Sakuma Daisuke Mukai Kouji Meguro Ren Sakuma Daisuke Abe Ryouhei Miyadate Ryota Watanabe Shouta Iwamoto Hikaru Fukazawa Tatsuya Murakami Maito Raul and a bunch of random johnnys cameos tagging everyone first but they'll slowly show up in later chapters POV Multiple Alternate Universe - Fantasy how many animals can op give the boys before they become a travelling menagerie challenge non-linear timeline pure of heart dumb of ass mentions of setting-typical violence setting-typical tragic backstories yes there's going to be romance in this fic but it is SLOW BURN like pretty slow burn
Pieces of a Puzzle,niji728,"消えた初恋 | Kieta Hatsukoi | Vanishing My First Love (TV) RPF, Snow Man (Japan Band), なにわ男子 | Naniwa Danshi (Band)",https://archiveofourown.org/works/39262476,119,Summary: A year after the filming of Kieta Hatsukoi Shunsuke and Ren meet at the root of a mountain and things take an unexpected turn.,Explicit No Archive Warnings Apply M/M 消えた初恋 | Kieta Hatsukoi | Vanishing My First Love (TV) RPF Snow Man (Japan Band) なにわ男子 | Naniwa Danshi (Band) Meguro Ren/Michieda Shunsuke Michieda Shunsuke Meguro Ren Canon Compliant Getting Together First Time Domestic Bliss Micchi thinks too much Meme has no fear There Was Only One Bath climbing a mountain figuratively and literally Feelings Realization
More than friends,rqs902,"消えた初恋 | Kieta Hatsukoi | Vanishing My First Love (TV), Snow Man (Japan Band), なにわ男子 | Naniwa Danshi (Band), Johnny's Entertainment",https://archiveofourown.org/works/35427529,119,"Summary: Shunsuke has always been an excellent student, whereas Ren struggles academically. Daigo, who has been Shunsuke's best friend for as long as he can remember, has never understood why Shunsuke and Ren are so close.",General Audiences No Archive Warnings Apply M/M 消えた初恋 | Kieta Hatsukoi | Vanishing My First Love (TV) Snow Man (Japan Band) なにわ男子 | Naniwa Danshi (Band) Johnny's Entertainment Meguro Ren/Michieda Shunsuke Michieda Shunsuke/Nishihata Daigo Meguro Ren/Murakami Maito Raul Meguro Ren Michieda Shunsuke Nishihata Daigo Murakami Maito Raul I started watching Kieta Hatsukoi on a whim and now I'm in too deep
saturday morning,hiraishin (littlescallion),"消えた初恋 | Kieta Hatsukoi | Vanishing My First Love (TV), Snow Man (Japan Band), なにわ男子 | Naniwa Danshi (Band)",https://archiveofourown.org/works/54332515,113,"Summary: on a saturday morning, aoki comes to ida's apartment to wake him up",Teen And Up Audiences No Archive Warnings Apply M/M 消えた初恋 | Kieta Hatsukoi | Vanishing My First Love (TV) Snow Man (Japan Band) なにわ男子 | Naniwa Danshi (Band) Aoki Souta/Ida Kousuke Meguro Ren/Michieda Shunsuke Aoki Souta Ida Kousuke Alternate Universe - Post-Canon Established Relationship Dating University Fluff Domestic Fluff Tooth-Rotting Fluff
I Want To Hear Your Voice,taboonalady,Snow Man (Japan Band),https://archiveofourown.org/works/34657561,103,"Summary: A drabble/ficlet collection of anything and all Snow Man! I'll add tags as works are added. Chapter 1: Pinned Down (Watanabe/Abe) Chapter 2: Known Forever (Fukazawa/Abe) Chapter 3: Abe-chan Sensei (Abe/Meguro) Chapter 4: Status: In A Relationship (Abe/Meguro) Chapter 5: Moments Shared (Abe/Meguro) Chapter 6: At Long Last (Abe/Meguro) Chapter 7: The Best Feeling (Mukai/Sakuma) Chapter 8: By the Tokyo Tower, Under the Moonlit Sky (Abe/Meguro)",Not Rated No Archive Warnings Apply Gen M/M Snow Man (Japan Band) Abe Ryouhei/Watanabe Shouta Abe Ryouhei/Fukazawa Tatsuya Abe Ryouhei/Meguro Ren Mukai Kouji/Sakuma Daisuke Abe Ryouhei Watanabe Shouta Fukazawa Tatsuya Meguro Ren Mukai Kouji Sakuma Daisuke Fluff Romance Drabble Drabble Collection Ficlet Collection Ficlet Unrequited Love Love Confessions Childhood Friends Alternate Universe - College/University Social Media Established Relationship Secret Relationship Light Angst Longing
this love's delicious,goodknightpng,"なにわ男子 | Naniwa Danshi (Band), Snow Man (Japan Band)",https://archiveofourown.org/works/36126727,101,Summary: meguro and michieda ease themselves into their new relationship.,"Explicit No Archive Warnings Apply M/M なにわ男子 | Naniwa Danshi (Band) Snow Man (Japan Band) Meguro Ren/Michieda Shunsuke Michieda Shunsuke Meguro Ren Canon Compliant First Time Kissing Ass Play Hand Jobs Dirty Talk uhhh some of these tags are just brief paragraphs of the fic sorry to get your hopes up lol i use the phrase ""like a girl"" if that bothers you lapslock"
Ubu Love,niji728,"消えた初恋 | Kieta Hatsukoi | Vanishing My First Love (TV) RPF, Snow Man (Japan Band), なにわ男子 | Naniwa Danshi (Band), Johnny's Entertainment",https://archiveofourown.org/works/40555386,97,"Summary: You promised me a beer, Meguro-kun. Micchi turns twenty. Meme invites him over. Things escalate from there.",Explicit No Archive Warnings Apply M/M 消えた初恋 | Kieta Hatsukoi | Vanishing My First Love (TV) RPF Snow Man (Japan Band) なにわ男子 | Naniwa Danshi (Band) Johnny's Entertainment Meguro Ren/Michieda Shunsuke Michieda Shunsuke Meguro Ren Canon Compliant Romance Mutual Pining Unresolved Sexual Tension Hand Jobs Birthday Smut Micchi turns twenty Ren's life is hard poor Koji whose cabbage was eaten Misunderstandings
regret,januariesty,"Snow Man (Japan Band), なにわ男子 | Naniwa Danshi (Band)",https://archiveofourown.org/works/36562366,91,"Summary: ""But you never tried to stop me! So, why are you blaming all this on me?"" ""The real question is, would you stay even if I begged you to stay?""",Not Rated Creator Chose Not To Use Archive Warnings M/M Snow Man (Japan Band) なにわ男子 | Naniwa Danshi (Band) Meguro Ren/Michieda Shunsuke Meguro Ren Michieda Shunsuke Model! Micchi Light Angst Married Couple Married Life CEO! Meme
My love is blooming. It's just starting to bloom.,Anonymous,"Snow Man (Japan Band), なにわ男子 | Naniwa Danshi (Band), 消えた初恋 | Kieta Hatsukoi | Vanishing My First Love (TV) RPF",https://archiveofourown.org/works/35832661,91,"Summary: Meguro Ren likes the stars, and he likes Michieda too.",General Audiences No Archive Warnings Apply Gen M/M Snow Man (Japan Band) なにわ男子 | Naniwa Danshi (Band) 消えた初恋 | Kieta Hatsukoi | Vanishing My First Love (TV) RPF Meguro Ren/Michieda Shunsuke Meguro Ren Michieda Shunsuke Fluff Canon Compliant
on my lips (your laughter is the sweetest),luway,Stray Kids (Band),https://archiveofourown.org/works/16009088,"13,077","Summary: Jisung cleared his throat, a sudden feeling of embarrassment coming over him. He stared at the paper cup in his hands as he spoke. ""So you're really nice and all, and your cocoa is amazing, but the whole lip thing— I can see you staring when I talk and I just wanted to say it's kind of uncom-"" ""Uh sorry, strange question, but could you look up at me?"" Minho suddenly asked. ""I need to read your lips or else I can't really understand what you're saying."" aka Jisung asks barista Minho to stop staring at his lips, not realizing Minho is deaf, and kind of has to. Minho thinks Jisung's lips are pretty",General Audiences Creator Chose Not To Use Archive Warnings M/M Stray Kids (Band) Han Jisung | Han/Lee Minho | Lee Know Han Jisung | Han & Lee Minho | Lee Know Han Jisung | Han Lee Minho | Lee Know Bang Chan Kim Woojin Seo Changbin Hwang Hyunjin Lee Felix Yang Jeongin | I.N Kim Seungmin Alternate Universe - Coffee Shops & Cafés kind of Deaf Character Meet-Cute Friends to Lovers Jisung makes a fool out of himself theyre both cute im projecting onto my writing whats new Fluff Fluff and Angst Kissing
MFA (Most Fuckable Ass),hyunnies,Stray Kids (Band),https://archiveofourown.org/works/45320833,"11,465","Summary: Professor Lee. Well-spoken and scarily clever and fifteen years older than Jisung, which should make him want him less, not more, but Jisung wants him so badly. He wants to be wanted by him. Jisung has a fiction workshop every Wednesday. He also has a hopeless crush on his professor.",Explicit No Archive Warnings Apply M/M Stray Kids (Band) Han Jisung | Han/Lee Minho | Lee Know Han Jisung | Han & Lee Felix Han Jisung | Han Lee Minho | Lee Know Lee Felix (Stray Kids) Teacher-Student Relationship Professor Lee Minho | Lee Know Student Han Jisung | Han Age Difference Masturbation Pining Platonic Kissing Slow Burn Daddy Kink Explicit Sexual Content
hands-on learning,dawnshine,Stray Kids (Band),https://archiveofourown.org/works/28703571,"10,907","Summary: Minho tutors Jisung in math. Jisung is a player and devastatingly straight. However, he doesn't seem to have much of a problem with letting Minho suck his dick every week when Minho propositions him under the guise of earning experience to woo his ""crush"" - which is none other than Jisung himself. But he doesn't need to know that, right? Right. Unless, maybe, Minho has a chance at something more after all...?",Explicit No Archive Warnings Apply M/M Stray Kids (Band) Han Jisung | Han/Lee Minho | Lee Know Lee Minho | Lee Know Han Jisung | Han Alternate Universe - College/University mostly porn with a bit of plot Porn with Feelings Friends to Lovers Top Han Jisung | Han Bottom Lee Minho | Lee Know First Time virgin tutor!minho straight fuckboy!jisung Submissive Lee Minho | Lee Know most self indulgent filth i will ever write Hand Jobs Blow Jobs Semi-Public Sex Teasing hella teasing. jisung is a shithead but also soft Spit Kink Pining Anal Sex Minor Kim Seungmin/Seo Changbin plus brief chanlix mention Porn With Plot
don't leave me tongue-tied,dawnshine,Stray Kids (Band),https://archiveofourown.org/works/29494620,"9,261","Summary: After wishing on a star, Jisung develops the bizarre ability to see ""lust gauges"" of the people around him, displaying the current arousal levels of their owners. As if that weren't strange enough, his best friend Minho's gauge is always filled to the brim despite him being one of the most calm and collected people Jisung knows. Is something wrong with his new power, or is Minho seriously that horny? Jisung figures he should take matters into his own hands―literally―before Minho's unhinged lust becomes a serious problem. Other problems arise, like worrying over Minho so much he has no time to use his new power to score himself a girlfriend. That, and the complicated feelings that inevitably come with the territory of sleeping with his best friend.",Explicit No Archive Warnings Apply M/M Stray Kids (Band) Han Jisung | Han/Lee Minho | Lee Know Han Jisung | Han Lee Minho | Lee Know Kim Seungmin Seo Changbin Yang Jeongin | I.N Shin Ryujin Alternate Universe - College/University Friends to Lovers Friends With Benefits idiots with benefits to lovers Humor Lee Minho | Lee Know is Whipped Oblivious Han Jisung | Han im talking dense as a brick Bickering Teasing Porn with Feelings Light Angst Denial of Feelings Slow Burn like an emotional slow burn physically not so much Misunderstandings Fluff Switching Minor Kim Seungmin/Seo Changbin Перевод на русский | Translation in Russian Crack basically bc the concept and they're just really dumb please stop reading this fic
"Bark on Bark, Petal Strands",Celestios,Stray Kids (Band),https://archiveofourown.org/works/32297578,"8,988","Summary: Minho wasn’t getting any younger, though he wasn’t necessarily a ticking time bomb, he was still not interested in jumping from job to job. He wanted a stable, whole pack, a place to belong where he didn’t need to worry about stability or fight for it. And though he didn’t need it, he wanted it. And that was a good summary of his power—he didn’t need one. But he wanted one. OR Chan hires Minho to be the omega caretaker his omegas need.",Explicit No Archive Warnings Apply Multi Stray Kids (Band) Bang Chan/Lee Minho | Lee Know Bang Chan/Lee Felix Bang Chan/Everyone Han Jisung | Han/Seo Changbin Hwang Hyunjin/Lee Felix Hwang Hyunjin/Kim Seungmin Han Jisung | Han/Hwang Hyunjin/Kim Seungmin/Lee Felix Hwang Hyunjin/Kim Seungmin/Yang Jeongin | I.N Yang Jeongin | I.N/Everyone Bang Chan/Seo Changbin Seo Changbin/Everyone Lee Minho | Lee Know/Lee Minhyuk (BTOB) They date for a bit Bang Chan Lee Minho | Lee Know Lee Felix (Stray Kids) Yang Jeongin | I.N Hwang Hyunjin Han Jisung | Han Kim Seungmin Seo Changbin Lee Minhyuk (BTOB) Kim Hongjoong Alpha/Beta/Omega Dynamics Non-Traditional Alpha/Beta/Omega Dynamics Pack Dynamics Pack Bonding Caretaking as an emotional need Alpha Bang Chan Alpha Han Jisung | Han Alpha Seo Changbin Beta Kim Seungmin Omega Hwang Hyunjin Omega Lee Felix (Stray Kids) Omega Yang Jeongin | I.N Spanking Possessive Behavior Territorial Alphas littlespace Slightly - Freeform Non-Sexual Age Regression Do not sexualize them please little yang jeongin pack alpha bang chan Non-Sexual Intimacy Trans Character age gap Age Difference slight age gap Omega Lee Minho | Lee Know Jeongin is not a minor or a child he is a little OOC behaviors PTSD Healing Anger Therapy Talks
so sweet like chocolate,luckyday,Stray Kids (Band),https://archiveofourown.org/works/18037493,"7,993","Summary: Jisung's never exactly been the studious type. Sure, he's smart in his own way, but that doesn't necessarily transfer over to the kind of intelligence that the education system relies on. Tired of struggling after his first semester, he takes his friend up on the advice of actually using the school library to work. Enter Lee Minho, with his soft hair and pretty voice and his eyes that hold the galaxies in them. If he was only pretty, Jisung might've gotten away with just a fleeting crush. Unfortunately for him, Minho is funny and kind and quickly figures out that the fastest way to Jisung's heart is through his stomach-- and by being an attentive friend. So in short, Jisung's screwed. - Or, the one where Jisung's a little in love with a cute librarian and maybe, just maybe, the cute librarian is a little in love with him too.",Teen And Up Audiences No Archive Warnings Apply M/M Stray Kids (Band) Han Jisung | Han/Lee Minho | Lee Know Han Jisung | Han Lee Minho | Lee Know Kim Seungmin Lee Felix (Stray Kids) Seo Changbin Alternate Universe - College/University Strangers to Lovers Friends to Lovers Slow Burn Mutual Pining Fluff Tooth-Rotting Fluff I Put My Favorite Fluff Tropes In A Blender And This Was What Happened Food as a Metaphor for Love It's All Very Cheesy And Dramatic They're Both Very Gay And Very Stupid Background Kim Seungmin/Lee Felix Minor Hwang Hyunjin/Seo Changbin Translation Available
The Curse of Saturdays,indifferentyoongi,Stray Kids (Band),https://archiveofourown.org/works/16010675,"7,991","Summary: His dad's girlfriend was sweet for wanting to help Minho find a boyfriend, going as far as roping her own daughter into bringing over a friend for him to connect with. She meant well, she did. So maybe that’s why he said it. It was true that he didn’t have time for dating with graduation so soon, but he definitely didn’t have time to disappoint Dahyun, who patted the top of his dad’s head like they were teenagers, Dahyun who managed to place an uncharacteristic pink blush across his dad’s cheeks. “I’m dating someone,” he’d said. And without further question or doubt, Dahyun replied, “Oh, then bring him to scary movie night with you. If in the horror movie of our life we decide he dies later than your dad, I approve.” _____ Or, Minho needs a fake boyfriend for one night and Changbin has an idea.",Teen And Up Audiences No Archive Warnings Apply M/M Stray Kids (Band) Han Jisung | Han/Lee Minho | Lee Know Lee Minho Han Jisung | Han Seo Changbin Stray Kids Ensemble Fake/Pretend Relationship Alternate Universe - College/University Aged-Up Character(s) Alcohol Slow Burn Strangers to Friends to Lovers Minbin Bffs Everyone is here but Minsung and Changbin are the main cast This is all banter and fluff folks please enjoy No Angst
heads or tails,liknow,Stray Kids (Band),https://archiveofourown.org/works/29604090,"7,855",Summary: Minho and Jisung are sick and tired of being virgins. There's an obvious solution to that. or: Two best friends decide that it only makes sense to lose their virginity together. What doesn't make sense is the way they can't seem to keep their hands off each other after that.,Explicit No Archive Warnings Apply M/M Stray Kids (Band) Han Jisung | Han/Lee Minho | Lee Know Lee Minho | Lee Know Han Jisung | Han Alternate Universe - College/University Best Friends Loss of Virginity Friends With Benefits Friends to Lovers Explicit Sexual Content First Time Anal Sex Kink Exploration Feelings Realization Porn with Feelings Fluff Smut Happy Ending Top Han Jisung | Han Bottom Lee Minho | Lee Know Bottom Han Jisung | Han Top Lee Minho | Lee Know Minor Kim Seungmin/Seo Changbin
Lee Minho is the guru your heart needs,sparklining,Stray Kids (Band),https://archiveofourown.org/works/27416161,"7,570","Summary: Stray Kids OT8 sliding into happy polyamory, as documented by their chat logs.  minnieinnie: so this is the hyung chat minnieinnie: what do you guys normally talk about in here? binbinbin: grown up stuff threecats: what ramen brand tastes the best channiehyungie: grown up stuff channiehyungie: minho please  Click here for a summary of plot points, lists of usernames and chat titles. Orgies / group sex (whole group) in chapters 35, 55 and 79 ;)",Explicit No Archive Warnings Apply M/M Stray Kids (Band) Hwang Hyunjin/Kim Seungmin Bang Chan/Lee Minho | Lee Know Bang Chan/Han Jisung/Hwang Hyunjin/Kim Seungmin/Lee Felix/Lee Minho/Seo Changbin/Yang Jeongin Han Jisung | Han/Hwang Hyunjin Lee Felix/Seo Changbin Bang Chan/Han Jisung | Han Han Jisung | Han/Lee Minho | Lee Know Kim Seungmin/Lee Minho | Lee Know Hwang Hyunjin/Kim Seungmin/Lee Minho | Lee Know Hwang Hyunjin/Yang Jeongin | I.N Han Jisung | Han/Everyone Hwang Hyunjin/Everyone Yang Jeongin | I.N/Everyone Bang Chan/Yang Jeongin | I.N Hwang Hyunjin/Lee Minho | Lee Know Lee Minho | Lee Know/Yang Jeongin | I.N Han Jisung | Han/Hwang Hyunjin/Kim Seungmin Hwang Hyunjin/Lee Felix/Seo Changbin Han Jisung | Han/Lee Felix Hwang Hyunjin/Lee Felix Bang Chan/Lee Felix Kim Seungmin/Yang Jeongin | I.N Han Jisung | Han/Kim Seungmin Lee Felix/Lee Minho | Lee Know Lee Minho | Lee Know/Seo Changbin Lee Felix/Lee Minho | Lee Know/Seo Changbin Bang Chan/Lee Minho | Lee Know/Yang Jeongin | I.N Stray Kids Ensemble OT8 Chatting & Messaging Sex Education Canon Compliant Lee Minho | Lee Know is a Confident Gay Bad Sex First Time Bang Chan is a Good Hyung yang jeongin is a chaos demon Sexting Polyamory Fluff and Humor Sexual Humor Kinks sharing is caring Loss of Virginity Getting Together Misunderstandings Soft Lee Felix (Stray Kids) Cock Warming Rimming Anal Sex Threesome - M/M/M Edgeplay Phone Sex Comeplay Voyeurism Banter Exhibitionism Enthusiastic Consent Secret Santa Fishnets Sex Toys Falling In Love Sex Guided Sex consensual voyeurism Consensual Exhibitionism Shibari Nude Photos Bang Chan is Whipped (Stray Kids) Slow Burn Foursome - M/M/M/M
Gravity,bitsori,Stray Kids (Band),https://archiveofourown.org/works/18959341,"7,419","Summary: “Do you know he calls you his soulmate?” Minho almost spits his drink out when Changbin asks this. “Uh, yeah, he wrote this for a broadcast letter, once.” “No, I mean— he’s actually said it. Out loud. To me,” Changbin says, looking directly at Minho as if he’s trying to gauge the older’s reaction, before he adds, “Without cameras.” “I’m sure all the members are important to him,” Minho points out. “Yeah, but he doesn't call the rest of us his soulmates,” Changbin mumbles, under his breath and almost inaudible. -- or: Minho and Jisung are soulmates, except it’s not an AU. It’s real life.   EDITED 200908 [ Russian (DISC), Español, Persian, Español 2, Russian 2 ]",Mature No Archive Warnings Apply M/M Stray Kids (Band) Han Jisung | Han/Lee Minho | Lee Know Han Jisung | Han Lee Minho | Lee Know Stray Kids Ensemble Canon Compliant First Meetings Developing Relationship Falling In Love Slow Burn Friends to Lovers Male Friendship Coming of Age Character Study Background Han Jisung | Han/Everyone Background Lee Minho | Lee Know/Everyone Перевод на русский | Translation in Russian Translation in Español Translation in Persian
