Title,Author,Fandom,Url,Kudos,Summary,Content
Nepenthe,BBQkitten,"방탄소년단 | Bangtan Boys | BTS, EXO (Band)",https://archiveofourown.org/works/27532750,"4,829","Summary: Jungkook woke to full body aches. He groaned, burying his face into the mattress as his muscles spasmed. Fuck. He bit his lip and his muscles tensed and untensed again. He needed to call in to work. He couldn’t afford to be sick but he didn’t have a choice. He knew he couldn’t work in heat. Normal heats were bad enough but his were an absolute nightmare since— Jungkook closed his eyes, clutching at his abdomen where a thick scar ran across horizontally. No. Don't think about it. OR Jungkook is an omega just trying to survive until he meets a pack that teaches him how to live.",Teen And Up Audiences Creator Chose Not To Use Archive Warnings M/M Multi 방탄소년단 | Bangtan Boys | BTS EXO (Band) Jeon Jungkook/Jung Hoseok/Kim Namjoon/Kim Seokjin/Kim Taehyung/Min Yoongi/Park Jimin Jeon Jungkook/Everyone Jeon Jungkook Jung Hoseok | J-Hope Kim Namjoon | RM Kim Seokjin | Jin Kim Taehyung | V Min Yoongi | Suga Park Jimin (BTS) Do Kyungsoo | D.O Park Chanyeol Zhang Yi Xing | Lay Implied/Referenced Rape/Non-con Implied/Referenced Torture Alpha Kim Namjoon | RM Alpha Min Yoongi | Suga Alpha/Beta/Omega Dynamics Beta Kim Seokjin | Jin Beta Jung Hoseok | J-Hope Omega Kim Taehyung | V Omega Park Jimin (BTS) Omega Jeon Jungkook lots of fluff Angst and Hurt/Comfort Everyone Loves Jeon Jungkook overprotective hyungs Violence EXO love Jungkook Jeon Jungkook Needs a Hug Jeon Jungkook gets all the hugs Polyamory
97-Liners Groupchat,Novii,"방탄소년단 | Bangtan Boys | BTS, GOT7, SEVENTEEN (Band), NCT (Band), ASTRO (Band), Stray Kids (Band), TOMORROW X TOGETHER | TXT (Korea Band), IU (Musician), EXO (Band), Red Velvet (K-pop Band), TWICE (Band), BLACKPINK (Band)",https://archiveofourown.org/works/18841864,"4,285","Summary: Thaibaby: EUNWOO Thaibaby: DO ALIENS EXIST OR NOT EarlyBird: HOW AM I SUPPOSED TO KNOW Thaibaby: YOUR GROUPS NAME IS ASTRO Megaphone: you lost me there Greekgod: yeah me too Lostboy: jae you made everyone lost EarlyBird: I- EarlyBird: so that makes me the expert on all things space??? HitTheYug: YES Thaibaby: YES KookieMonster: got7 really do share one braincell EiffelPuppy: no kidding ________ Or somehow this went from a meaningless crack fic to a meaningless crack, slight angst and fluff fic. Oh and they troll dispatch.",Not Rated Creator Chose Not To Use Archive Warnings Multi 방탄소년단 | Bangtan Boys | BTS GOT7 SEVENTEEN (Band) NCT (Band) ASTRO (Band) Stray Kids (Band) TOMORROW X TOGETHER | TXT (Korea Band) IU (Musician) EXO (Band) Red Velvet (K-pop Band) TWICE (Band) BLACKPINK (Band) Jeon Jungkook/Everyone Kim Yugyeom/Everyone Jung Yoonoh | Jaehyun/Everyone Xu Ming Hao | The8/Everyone Kunpimook Bhuwakul | BamBam/Everyone Lee Seokmin | DK/Everyone Kim Mingyu/Everyone Lee Dongmin | Cha Eunwoo/Everyone Kim Namjoon | RM/Everyone Lee Taeyong/Everyone Im Jaebum | JB/Everyone Choi Seungcheol | S.Coups/Everyone Park Jinwoo | Jin Jin/Everyone Jeon Jungkook/Jung Hoseok/Kim Namjoon/Kim Seokjin/Kim Taehyung/Min Yoongi/Park Jimin BamBam/Choi Youngjae/Im Jaebum/Kim Yugyeom/Park Jinyoung/Mark Tuan/Jackson Wang Jung Yoonoh | Jaehyun/Kim Dongyoung | Doyoung/Lee Taeyong/Ten/Nakamoto Yuta/Suh Youngho | Johnny Kim Myungjun | MJ/Cha Eunwoo/Moon Bin/Park Jinwoo | Jin Jin/Park Minhyuk | Rocky/Yoon Sanha Kim Mingyu/Lee Seokmin | DK/Xu Ming Hao | The8 Jeon Jungkook Kunpimook Bhuwakul | BamBam Kim Yugyeom Jung Yoonoh | Jaehyun Lee Seokmin | DK Kim Mingyu Xu Ming Hao | The8 Lee Dongmin | Cha Eunwoo Lee Taeyong Kim Namjoon | RM Park Jinwoo | Jin Jin Im Jaebum | JB Choi Seungcheol | S.Coups Bang Chan Im Nayeon Lee Jieun | IU Choi Soobin Na Jaemin Choi Yeonjun Bae Joohyun | Irene Mentioned Bangtan Boys Ensemble Mentioned GOT7 Ensemble Mentioned SEVENTEEN Ensemble Crack Humor Chatting & Messaging Inappropriate Humor Fluff Mentioned NCT Ensemble Mentioned TWICE Ensemble Light Angst Mild Hurt/Comfort Implied Sexual Content Mentioned ASTRO Ensemble Polyamory Fluff and Angst Mentioned Stray Kids Ensemble Mentioned Bang Chan Texting Leaders Groupchat Mentioned Red Velvet Ensemble Mentioned BLACKPINK
A Prize to be Claimed,byunthebunny,EXO (Band),https://archiveofourown.org/works/17394146,"4,153","Summary: Baekhyun didn’t think much of it when Chanyeol, his childhood nemesis, won a tournament held by their pack. That is, until said nemesis demanded him as a prize.",Explicit Creator Chose Not To Use Archive Warnings M/M EXO (Band) Byun Baekhyun/Park Chanyeol Oh Sehun Kim Minseok | Xiumin Park Chanyeol Byun Baekhyun Alpha/Beta/Omega Dynamics Alpha Park Chanyeol Omega Byun Baekhyun Bullying Angst Love/Hate Enemies to Lovers Arranged Marriage Mates Mating Cycles/In Heat Mpreg Claiming Bites Knotting Smut Fluff
If The Police Ask,"baeconandeggs, masaringo",EXO (Band),https://archiveofourown.org/works/3937288,"3,896","Summary: Falling in love through the lens of your telescope seemed impossible, stupid even. Especially when you are thirteen. But, if as time goes by your feelings for your seven years older next door neighbor only grow stronger, would it still be considered a childish crush?",Explicit Creator Chose Not To Use Archive Warnings M/M EXO (Band) Byun Baekhyun/Park Chanyeol Byun Baekhyun Park Chanyeol Age Difference Underage Sex (when 17 y/o) Cock Piercing Awkward Sexual Situations Drunk Sex Slow Burn Friends to Lovers Past Do Kyungsoo | D.O/Park Chanyeol Minor Do Kyungsoo | D.O/Oh Sehun Minor Lu Han/Zhang Yi Xing | Lay Growing Up Homophobia slight bullying Do Kyungsoo | D.O & Park Chanyeol are Best Friends Domestic Fluff Angst and Fluff and Smut First Time Neighbors Don’t copy to another site
Staring Through the Demons,Bexless,"My Chemical Romance, Fall Out Boy",https://archiveofourown.org/works/231222,"3,504","Summary: Pete and Patrick were still looking expectant, so Mikey said, “So we’re a group of…traveling…personal grooming experts. I guess.” Patrick looked at Gerard. “And their priest.” “We’re very spiritual,” Ray mumbled.",Mature Graphic Depictions Of Violence Major Character Death My Chemical Romance Fall Out Boy Frank Iero/Gerard Way Ray Toro/Mikey Way Frank Iero Mikey Way Gerard Way Ray Toro Bob Bryar Brian Schechter Original Characters Pete Wentz Patrick Stump Joe Trohman Andy Hurley Craig Aaronson Alternate Universe - Religious Religious Themes & References Christianity Catholic Character Torture Psychological Trauma Blood Alternate Universe - Career Pining Grief Unresolved Sexual Tension Unresolved Romantic Tension Friendship
the joker laughs at you (don't you think?),SoloChaos,"Bandom, Twenty One Pilots, Fall Out Boy, Panic! at the Disco",https://archiveofourown.org/works/1198281,"3,016","Summary: Joshua Dun has a nice mouth. Tyler isn't gay, you guys.",Teen And Up Audiences No Archive Warnings Apply M/M Bandom Twenty One Pilots Fall Out Boy Panic! at the Disco Josh Dun/Tyler Joseph Patrick Stump/Pete Wentz Tyler Joseph Josh Dun Brendon Urie Patrick Stump Pete Wentz Don't copy to another site
A Little Infamy,ladyfoxxx,"Bandom, Fall Out Boy",https://archiveofourown.org/works/858826,"2,886",Summary: Patrick is a solo artist who's sunk his heart and soul into a second album that's failing to chart. Obviously what he needs to bump up sales and dirty up his nice guy image is a sex scandal. His music label hire amateur porn star and aspiring poet Pete to pose as Patrick's boyfriend and together they make one intimate video destined for infamy on the internet. Patrick falling for Pete isn't part of the plan.,Explicit No Archive Warnings Apply M/M Bandom Fall Out Boy Patrick Stump/Pete Wentz Pete Wentz Patrick Stump Butch Walker Lupe Fiasco William Beckett Gabe Saporta Travis McCoy Ryan Ross Brendon Urie Victoria Asher Sex Tape sex scandal Alternate Universe Alternate Universe - Porn Publicity Paparazzi Fake/Pretend Relationship Voyeurism
500 Baskets,emeraldcitydowntowngirl,"Bandom, Twenty One Pilots, Fall Out Boy",https://archiveofourown.org/works/5836147,"2,738","Summary: The rule was simple: Make 500 baskets, or you don’t get dinner. - Contrary to popular belief, basketball player Tyler Joseph doesn’t have it as good as everyone* thinks he does *Josh Dun, the quote unquote new kid with blue hair and crazy friends",Mature No Archive Warnings Apply M/M F/F Multi Bandom Twenty One Pilots Fall Out Boy Josh Dun/Tyler Joseph Patrick Stump/Pete Wentz Jenna Black/Hayley Williams Tyler Joseph Tyler Joseph's Family Josh Dun Pete Wentz Patrick Stump Hayley Williams Jenna Black Blurryface (Character) is blurryface a character Abuse Unhealthy Coping Mechanisms Emotional Hurt/Comfort Hurt/Comfort Internalized Homophobia lots of man tears Homophobic Language in some parts half of it is josh bein smiley and fun and the other half of it is sad tyler Blurryface Angst with a Happy Ending Questioning Religion Suicidal Thoughts
These Eyes Are Blind,"Helena_Hathaway, mcr_rockstar","My Chemical Romance, Panic! at the Disco, Fall Out Boy",https://archiveofourown.org/works/2416469,"2,730","Summary: They say love is blind, but Frank's taking that to a more literal sense. So many people try to distance themselves from being called normal, but that's really all Frank wants. He's sick of being different. He's also sick of being alone, but he's made himself comfortable with it. To be blind is to be alone. Or at least he'd had every intention to be alone until he met Gerard. All Frank wants is to be normal, but it's Gerard who wants to make him see that he's far from it. Frank can't see with his eyes, but with his heart he sees Gerard, and he sees the beauty there.",Explicit No Archive Warnings Apply M/M My Chemical Romance Panic! at the Disco Fall Out Boy Frank Iero/Gerard Way Frank/Gerard Frank Iero Frank Gerard Way Gerard Mikey Way Brendon Urie Patrick Stump Pete Wentz Original Characters Frerard Eventual Happy Ending Blindness Blind Character Blind!Frank Angst and Humor Alternate Universe - High School Attempt at Humor Eventual Smut
The Group Chat AU That Nobody Asked For,Reddxn,"Bandom, Green Day, My Chemical Romance, Panic! at the Disco, Twenty One Pilots, Fall Out Boy, I Don't Know How But They Found Me (Band), The Brobecks",https://archiveofourown.org/works/8232398,"2,629",Summary: Frank makes a group chat and things (repeatedly) get out of hand,Not Rated No Archive Warnings Apply M/M Bandom Green Day My Chemical Romance Panic! at the Disco Twenty One Pilots Fall Out Boy I Don't Know How But They Found Me (Band) The Brobecks Frank Iero/Gerard Way Billie Joe Armstrong/Mike Dirnt Brendon Urie/Dallon Weekes Josh Dun/Tyler Joseph Ryan Ross/Brendon Urie Ryan Ross/Dallon Weekes Ryan Ross/Brendon Urie/Dallon Weekes Mikey Way/Pete Wentz Patrick Stump/Pete Wentz Ray Toro/Mikey Way Billie Joe Armstrong/Brendon Urie (kinda) - Relationship Billie Joe Armstrong Mike Dirnt Tré Cool Gerard Way Frank Iero Mikey Way Ray Toro Brendon Urie Dallon Weekes Tyler Joseph Josh Dun Ryan Ross Patrick Stump Pete Wentz Ryan Seaman Frerard Bike brallon joshler - Freeform Ryden Ryllon petekey Peterick Alternate Universe - High School Group chat Rikey A lot of cursing Memes dumb boys being idiots Everyone Is Gay
Inch of Skin,the_ragnarok,"Bandom, Fall Out Boy",https://archiveofourown.org/works/3225056,"2,487","Summary: In his interviews, Pete Wentz likes to joke about the soulmark. He went on a talk show once with his right wrist bared to show a temporary Care Bear tattoo. There was kind of a media uproar about it, which is the only reason Patrick knows this—he doesn't even follow media for musicians he likes. He's not going to do it for a pop-punk teen heartthrob who sold his soul to MTV.",Teen And Up Audiences No Archive Warnings Apply M/M Bandom Fall Out Boy Patrick Stump/Pete Wentz Epistolary Alternate Universe - Soulmates Soul Bond
The Chasing of Moons,Helena_Hathaway,"My Chemical Romance, Panic! at the Disco, Fall Out Boy",https://archiveofourown.org/works/3671964,"2,365","Summary: The biggest dilemma in all of this is that Frank slept with his future husband. Now Frank’s just got to make sure that the future with him stays intact, but it’s not so easy when present day Gerard seems to hate his guts.",Mature No Archive Warnings Apply M/M My Chemical Romance Panic! at the Disco Fall Out Boy Frank Iero/Gerard Way Frank/Gerard Side Pete/Mikey Frank Iero Frank Gerard Gerard Way Mikey Way Ray Toro Pete Wentz Brendon Urie Alternate Universe - High School High School Time Travel Funny Humor Eventual Happy Ending Not Actually Unrequited Love Alternate Universe - Time Travel Frerard Science Fiction ABSOLUTELY GUARANTEED HAPPY ENDING
Filthy Lucre.,risky_business,"Panic! at the Disco, Fall Out Boy, The Academy Is..., Cobra Starship, Bandom",https://archiveofourown.org/works/1039530,"2,221","Summary: AU. Ryan Ross is living the American wet dream. He’s rich, he’s good looking, he’s paid just to turn up at parties and he spends his days doing drugs and climbing into bed with eager and willing boys and girls. Brendon Urie is a man bordering on desperation – whoring himself out to wealthy men in an attempt to support himself and his best friend’s worsening drug habit. When his job ensnares him in the glamorous world of the rich and the infamous, it’s not long before their paths cross and Ryan starts living his dark fantasies though Brendon – but only for a price. See tags for triggers.",Explicit Graphic Depictions Of Violence Rape/Non-Con M/M Panic! at the Disco Fall Out Boy The Academy Is... Cobra Starship Bandom Ryan Ross/Brendon Urie Brendon Urie/Jon Walker Minor or Background Relationship(s) Jon Walker/Pete Wentz Brendon Urie/Dallon Weekes Erin Fetherston/Gabe Saporta Joe Trohman/Jon Walker Ryan Ross Brendon Urie Jon Walker William Beckett Gabe Saporta Joe Trohman Pete Wentz Zack Hall Shane Morris Dallon Weekes Erin Fetherston Patrick Stump Keltie Colleen Spencer Smith Ian Crawford Alternate Universe Prostitution Obsession Drug Use Drug Addiction Drugged Sex Cocaine Heroin Extremely Dubious Consent Graphic Description Rape/Non-con Elements Depression Implied Childhood Sexual Abuse Implied/Referenced Underage Prostitution Violent Sex Angst Blackmail Ryden Rewrite Explicit Sexual Content Explicit Language Rough Sex Filthy Lucre Frerard Drug Abuse Rehabilitation Violence Derogatory Language Implied/Referenced Cheating Sexual Violence Therapy Suicidal Thoughts Panic Attacks Implied/Referenced Self-Harm Antisemitism Homophobic Language
According To Your Heart (It's Our Time Now),fanatic_by_definition,Fall Out Boy,https://archiveofourown.org/works/3867289,"1,965","Summary: “Are—are you trying to say you’re okay with it? Kissing me in a fucking music video?” Patrick sounds horrified at the very notion of it. Pete does his best to not feel personally offended. “Just calm down, man, it’s really not a huge deal—” “Not a huge deal? Pete, it’s a kiss!” ### Pete pitches an idea for the ""The Kids Aren't Alright"" music video. It's misinterpreted. And while he might not mind so much, Patrick definitely does.",Explicit Graphic Depictions Of Violence M/M Fall Out Boy Patrick Stump/Pete Wentz Patrick Stump Pete Wentz Joe Trohman Andy Hurley First Kiss First Time Nightmares the kids aren't alright Making Out Practice Kissing Insomnia Frottage Hand Jobs the violence isnt technically 'real' but i'll use the warning anyway no wives or kids Anal Fingering Anal Sex Blow Jobs I'm Going to Hell
Stay and Burn,Keggy_Chaos,Ghost (Sweden Band),https://archiveofourown.org/works/19418920,"1,445","Summary: Cardinal Copia transfers to the main Church where you live. He is shy and quiet, and you are almost the polar opposite. However, something about the strange Cardinal pulls you in. As your world begins to fall apart around you, fighting against his pull is the last thing you feel like doing, but maybe you should.",Explicit No Archive Warnings Apply F/M Ghost (Sweden Band) Cardinal Copia/Reader Cardinal Copia/Original Female Character(s) Cardinal Copia Original Female Character(s) Papa Emeritus III Papa Emeritus Zero | Papa Emeritus Nihil Sister(s) of Sin Papa Emeritus IV Eventual Smut Eventual Romance Friendship Friends to Lovers Friendship/Love Porn With Plot Porn with Feelings Smut Fluff and Smut Sub Cardinal Copia Dom Cardinal Copia Switch Cardinal Copia
Stand by Them,Chaos__Incarnate,Ghost (Sweden Band),https://archiveofourown.org/works/42459780,"1,406","Summary: You are the newest ghoul to Ghost, adjusting to an interesting life as a resurrected demon. But transforming is a painful process, so Aether offers to help out. (I'm really bad a summarizing but fluff, smut, angst, etc ensue. You end up with a giant, horny, found family) (Also, all the tags will eventually appear. It's not really a slow burn, I just write too much sometimes)",Not Rated Graphic Depictions Of Violence F/F F/M M/M Multi Ghost (Sweden Band) Dewdrop Ghoul | Fire Ghoul/Reader Cirrus | Air Ghoulette/Reader Nameless Ghoulette(s)/Reader Nameless Ghoul(s)/Reader Rain | Water Ghoul/Reader Ghoul Pile - Relationship Aether | Quintessence Ghoul/Reader Mountain | Earth Ghoul/Reader Multi Ghoul | Swiss Army Ghoul/Reader Dewdrop Ghoul | Fire Ghoul Rain | Water Ghoul Aether | Quintessence Ghoul Mountain | Earth Ghoul Cirrus | Air Ghoulette Sunshine Ghoulette Cumulus | Air Ghoulette Multi Ghoul | Swiss Army Ghoul Papa Emeritus IV Polyamory Polyamorous Ghouls (Ghost) Bondage Fluff Angst Angst with a Happy Ending Porn with Feelings Eventual Smut Blood and Violence Not Beta Read we die like papa emeritus iii (sorry) one big happy and horny family Attempted Sexual Assault not by the ghouls Implied/Referenced Self-Harm Murder Torture not always the fun kind Impact Play Edging If you notice any mistakes no you don't sort of a slow burn but not really Hurt/Comfort Fluff and Smut Touch-Starved Suicidal Thoughts more feelings than porn at this point Self-Harm Discussions of Suicide Lots of biting Daddy Kink
Comet's Ficlet Collection,Comet (rebell),Ghost (Sweden Band),https://archiveofourown.org/works/44242756,"1,222","Summary: All of my tumblr askbox ficlets, now in one convenient location.",Explicit No Archive Warnings Apply F/F F/M M/M Multi Ghost (Sweden Band) Everyone/Everyone Dewdrop Ghoul | Fire Ghoul Aether | Quintessence Ghoul Omega | Quintessence Ghoul Mountain | Earth Ghoul Rain | Water Ghoul Multi Ghoul | Swiss Army Ghoul Cirrus | Air Ghoulette Cumulus | Air Ghoulette Sunshine Ghoulette Cardinal Copia Papa Emeritus IV Cowbell Ghoul Zephyr | Air Ghoul Nameless Ghoul(s) Nameless Ghoulette(s) Papa Emeritus III Sibling(s) of Sin Sister(s) of Sin Mist | Water Ghoulette Ifrit | Fire Ghoul Aurora Ghoulette Aeon Ghoul Phantom Ghoul Plot What Plot/Porn Without Plot Fluff and Angst Fluff Hurt/Comfort Body Worship Dewdrop Is A Little Shit (Ghost Sweden Band) Double Penetration Dom/sub Safeword Use Mirror Sex Anal Sex Cunnilingus Vaginal Fingering Anal Fingering Outdoor Sex Breeding Kink Domestic Fluff Spanking Feminization Forced Feminization Overstimulation Polyamorous Ghouls (Ghost) Rimming Degradation Angst Tooth-Rotting Fluff Teasing Squirting Shower Sex Blow Jobs Suspension Bondage Bondage Rope Bondage Gags Gangbang Hyperspermia Trans Male Character Knotting Masturbation Dildos Watersports Trans Female Character Sounding Gill Fucking
Ghost Drabbles,GasolineGhuleh,"Ghost (Sweden Band), Repugnant (Band)",https://archiveofourown.org/works/25924411,"1,113","Summary: Most of these will be NSFW Ghost drabbles, all taken from my Tumblr. Anything that fits here is generally below 1,000 words, or just a little bit over. Each chapter will be a different drabble and each will have a short description of what's contained.",Explicit No Archive Warnings Apply F/M M/M Multi Ghost (Sweden Band) Repugnant (Band) Cardinal Copia/Reader Mountain | Earth Ghoul/Reader Mary Goore/Reader Papa Emeritus III/Reader Dewdrop Ghoul | Fire Ghoul/Reader Cardinal Copia Mountain | Earth Ghoul Papa Emeritus III Mary Goore Oral Female oral Teasing Praise Teaching Over stimulation Blowjobs male oral Hair Pulling Biting Scratching Dirty Talk alleyway blowjobs Breeding cum kink Loving Sex Established Relationship Bratty Subs knots baths Bathing feral Dew Marking Letters Purple Prose collection
The Son Who Comes,officialoperaghost,Ghost (Sweden Band),https://archiveofourown.org/works/16621685,"1,057","Summary: Papa Emeritus III has a task for a sister of sin: she must get to know the mysterious new transfer to the abbey, the Cardinal, as Papa fears he's going to be replaced.",Explicit No Archive Warnings Apply Graphic Depictions Of Violence Multi Ghost (Sweden Band) Sister of Sin/Papa Emeritus III Sister of Sin/Cardinal Copia Cardinal Copia/Papa Emeritus III Papa Emeritus III Original Female Character(s) Cardinal Copia Papa Emeritus Zero | Papa Emeritus Nihil Sister Imperator Porn With Plot Voyeurism Size Difference Polyamory Threesome - F/M/M Blood and Injury Medical Procedures Angst and Hurt/Comfort Minor Character Death Canonical Character Death Cunnilingus Blow Jobs Confessional Sex Sub! Copia Anal Sex Cuckolding Exhibitionism Murder Alternative Universe: No one is related Had to update due to mounting lore I wrote this before shit went more or less canon but yeah NO
Various Ghost Drabbles and Ficlets,AdamantlyAdamant,Ghost (Sweden Band),https://archiveofourown.org/works/39586383,"1,019","Summary: A collection of shorter works that I'll post here as well as on my Tumblr. (Note: Not all works are explicit, but most will be. And I'll update the tags as I go along.)",Explicit No Archive Warnings Apply Multi Ghost (Sweden Band) Papa Emeritus I/Reader Papa Emeritus II/Reader Papa Emeritus III/Reader Cardinal Copia/Reader Papa Emeritus IV/Reader Cardinal Copia/Papa Emeritus III/Reader Cardinal Copia/Papa Emeritus III Papa Emeritus I Papa Emeritus II Papa Emeritus III Cardinal Copia Papa Emeritus IV Romance Smut Fluff Angst Emotional Hurt/Comfort
The Death of Peace of Mind,kroas_adtam,Ghost (Sweden Band),https://archiveofourown.org/works/42696093,985,"Summary: Previously titled Ruin Mountain & Dewdrop 2022 My Kinktober 2022 devolved into a messy plot line, so here's the chapters posted in an even messier timeline because I love you all and crave your validation over and over again and some of you asked for an easier way to get to the trauma boys rather than my nightmare kinktober set up *disclaimer: the og kinktober was never supposed to connect but here we are. yes there are continuity errors, I am planning on fixing it once I've destroyed all of you over and over again.",Explicit Creator Chose Not To Use Archive Warnings M/M Ghost (Sweden Band) Dewdrop Ghoul | Fire Ghoul/Mountain | Earth Ghoul Dewdrop Ghoul | Fire Ghoul/Multi Ghoul | Swiss Army Ghoul Aether | Quintessence Ghoul & Rain | Water Ghoul Mountain | Earth Ghoul/Multi Ghoul | Swiss Army Ghoul Aether | Quintessence Ghoul/Mountain | Earth Ghoul/Reader Dewdrop Ghoul | Fire Ghoul/Papa Emeritus III Dewdrop Ghoul | Fire Ghoul & Mountain | Earth Ghoul Mountain | Earth Ghoul Dewdrop Ghoul | Fire Ghoul Rain | Water Ghoul Multi Ghoul | Swiss Army Ghoul Aether | Quintessence Ghoul Papa Emeritus III Papa Emeritus IV Papa Emeritus I Papa Emeritus II Sister Imperator Hate Sex Cock Warming Size Difference Outdoor Sex Tender Sex Praise Kink Marking Mirror Sex Object Insertion Orgasm Denial Ghouls Ghouls are Demons Demons Elemental Magic Blood Biting Mating Cycles/In Heat Emotional Damage Porn With Plot Messy wreck the gremlins Monstrous Ghouls (Ghost) Hurt my goal is to make you cry Blood and Violence Rough Sex Dew Ifrit chapter could be considered dub con- dew is tipsy
